,question,answer,contexts,ground_truths,ground_truth,context_precision,context_recall,faithfulness,answer_relevancy
0,What’s the total assets?,"The total assets as of September 30, 2023, were $87,459.","['September 30,\n2023December 31,\n2022\nAssets\nCurrent assets\nCash and cash equivalents $ 15,932  $ 16,253  \nShort-term investments 10,145  5,932  \nAccounts receivable, net 2,520  2,952  \nInventory 13,721  12,839  \nPrepaid expenses and other current assets 2,708  2,941  \nTotal current assets 45,026  40,917  \nOperating lease vehicles, net 6,119 5,035  \nSolar ener gy systems, net 5,293  5,489  \nProperty , plant and equipment, net 27,744  23,548  \nOperating lease right-of-use assets 3,637  2,563'
 'September 30,\n2023December 31,\n2022\nAssets\nCurrent assets\nCash and cash equivalents $ 15,932  $ 16,253  \nShort-term investments 10,145  5,932  \nAccounts receivable, net 2,520  2,952  \nInventory 13,721  12,839  \nPrepaid expenses and other current assets 2,708  2,941  \nTotal current assets 45,026  40,917  \nOperating lease vehicles, net 6,119 5,035  \nSolar ener gy systems, net 5,293  5,489  \nProperty , plant and equipment, net 27,744  23,548  \nOperating lease right-of-use assets 3,637  2,563'
 'September 30,\n2023December 31,\n2022\nAssets\nCurrent assets\nCash and cash equivalents $ 15,932  $ 16,253  \nShort-term investments 10,145  5,932  \nAccounts receivable, net 2,520  2,952  \nInventory 13,721  12,839  \nPrepaid expenses and other current assets 2,708  2,941  \nTotal current assets 45,026  40,917  \nOperating lease vehicles, net 6,119 5,035  \nSolar ener gy systems, net 5,293  5,489  \nProperty , plant and equipment, net 27,744  23,548  \nOperating lease right-of-use assets 3,637  2,563'
 'September 30,\n2023December 31,\n2022\nAssets\nCurrent assets\nCash and cash equivalents $ 15,932  $ 16,253  \nShort-term investments 10,145  5,932  \nAccounts receivable, net 2,520  2,952  \nInventory 13,721  12,839  \nPrepaid expenses and other current assets 2,708  2,941  \nTotal current assets 45,026  40,917  \nOperating lease vehicles, net 6,119 5,035  \nSolar ener gy systems, net 5,293  5,489  \nProperty , plant and equipment, net 27,744  23,548  \nOperating lease right-of-use assets 3,637  2,563']","['The total assets of the company is $93,941.']","The total assets of the company is $93,941.",0.999999999975,0.0,0.0,0.8878738352627403
1,How much cash was provided by or used in operating activities during the quarter?,"Net cash provided by operating activities during the quarter was $8,886.","['Net cash provided by operating activities 8,886 11,446 \nCash Flows from Investing Activities\nPurchases of property and equipment excluding finance leases, net of sales (6,592) (5,300)\nPurchases of solar energy systems, net of sales — (5)\nProceeds from sales of digital assets — 936 \nPurchase of intangible assets — (9)\nPurchases of investments (13,221) (1,467)\nProceeds from maturities of investments 8,959 3 \nProceeds from sales of investments 138 —'
 'Net cash provided by operating activities 8,886 11,446 \nCash Flows from Investing Activities\nPurchases of property and equipment excluding finance leases, net of sales (6,592) (5,300)\nPurchases of solar energy systems, net of sales — (5)\nProceeds from sales of digital assets — 936 \nPurchase of intangible assets — (9)\nPurchases of investments (13,221) (1,467)\nProceeds from maturities of investments 8,959 3 \nProceeds from sales of investments 138 —'
 'Net cash provided by operating activities 8,886 11,446 \nCash Flows from Investing Activities\nPurchases of property and equipment excluding finance leases, net of sales (6,592) (5,300)\nPurchases of solar energy systems, net of sales — (5)\nProceeds from sales of digital assets — 936 \nPurchase of intangible assets — (9)\nPurchases of investments (13,221) (1,467)\nProceeds from maturities of investments 8,959 3 \nProceeds from sales of investments 138 —'
 'Net cash provided by operating activities 8,886 11,446 \nCash Flows from Investing Activities\nPurchases of property and equipment excluding finance leases, net of sales (6,592) (5,300)\nPurchases of solar energy systems, net of sales — (5)\nProceeds from sales of digital assets — 936 \nPurchase of intangible assets — (9)\nPurchases of investments (13,221) (1,467)\nProceeds from maturities of investments 8,959 3 \nProceeds from sales of investments 138 —']",['The amount of cash provided by or used in operating activities during the quarter was $8.89 billion.'],The amount of cash provided by or used in operating activities during the quarter was $8.89 billion.,0.999999999975,1.0,1.0,0.9600754904318544
2,What are the biggest risks for Tesla as a business?,"The biggest risks for Tesla as a business include legal proceedings, risks, and claims that arise from normal business activities, as well as potential data breaches leading to exposure of non-public business information.","['position or brand.\nWe are also subject to various other legal proceedings, risks and claims that arise from the normal course of business\nactivities. For example, during the second quarter of 2023, a foreign news outlet reported that it obtained certain misappropriated data\nincluding, purportedly, among other things, non-public Tesla business and personal information. Tesla has made notifications to'
 'position or brand.\nWe are also subject to various other legal proceedings, risks and claims that arise from the normal course of business\nactivities. For example, during the second quarter of 2023, a foreign news outlet reported that it obtained certain misappropriated data\nincluding, purportedly, among other things, non-public Tesla business and personal information. Tesla has made notifications to'
 'position or brand.\nWe are also subject to various other legal proceedings, risks and claims that arise from the normal course of business\nactivities. For example, during the second quarter of 2023, a foreign news outlet reported that it obtained certain misappropriated data\nincluding, purportedly, among other things, non-public Tesla business and personal information. Tesla has made notifications to'
 'position or brand.\nWe are also subject to various other legal proceedings, risks and claims that arise from the normal course of business\nactivities. For example, during the second quarter of 2023, a foreign news outlet reported that it obtained certain misappropriated data\nincluding, purportedly, among other things, non-public Tesla business and personal information. Tesla has made notifications to']",['The biggest risks for Tesla as a business are its ability to continue as a going concern and its inability to raise additional capital to fund its operations and growth.'],The biggest risks for Tesla as a business are its ability to continue as a going concern and its inability to raise additional capital to fund its operations and growth.,0.0,0.0,1.0,0.9944104313491584
